{
  "evaluations": [
    {
      "detail": "{\"androidx_api\": {\"cases\": 4, \"delta\": 0.125, \"failures\": [], \"p5\": 0.625, \"p6\": 0.75, \"required_knowledge_recall\": 1.0}, \"harness\": {\"cases\": 2, \"delta\": 0.375, \"failures\": [], \"p5\": 0.625, \"p6\": 1.0, \"required_knowledge_recall\": 1.0}, \"material3_content_design\": {\"cases\": 1, \"delta\": 1.0, \"failures\": [], \"p5\": 0.0, \"p6\": 1.0, \"required_knowledge_recall\": 1.0}, \"material3_xr\": {\"cases\": 1, \"delta\": 1.0, \"failures\": [], \"p5\": 0.0, \"p6\": 1.0, \"required_knowledge_recall\": 1.0}}",
      "id": "E_knowledge_precision",
      "status": "PASS"
    },
    {
      "detail": "Unreleased development channel is rejected unless an explicit isolated-test flag is supplied.",
      "id": "A_development_channel_guard",
      "status": "PASS"
    },
    {
      "detail": "Separate harness checkout, native skill files, and project config installed; knowledge remains in harness checkout.",
      "id": "A_clean_integration",
      "status": "PASS"
    },
    {
      "detail": "Existing AGENTS.md instructions and unrelated product data remained intact.",
      "id": "B_project_isolation",
      "status": "PASS"
    },
    {
      "detail": "Missing versions are flagged; synthetic declarations are visible but remain unverified and still require resolved dependency evidence.",
      "id": "C_project_versions",
      "status": "PASS"
    },
    {
      "detail": "Conflicting generic Hilt guidance is surfaced for an explicit owner decision; no project architecture was changed.",
      "id": "D_project_conflict",
      "status": "PASS"
    },
    {
      "detail": "Unsupported schema set blocks upgrade before modifying target files.",
      "id": "I_incompatible_schema",
      "status": "PASS"
    },
    {
      "detail": "0.6.1-dev synthetic update rolled back to the previous installed version and skill bytes.",
      "id": "J_upgrade_rollback",
      "status": "PASS"
    },
    {
      "detail": "Rollback refused to delete the user-edited project context and made no partial removal.",
      "id": "J_rollback_preserves_user_edits",
      "status": "PASS"
    },
    {
      "detail": "install=0 rollback=0 state=False config=False agents='# Existing instructions\\n' rollback_output=",
      "id": "J_clean_install_rollback",
      "status": "PASS"
    },
    {
      "detail": "Prohibited Android artifacts: []",
      "id": "A_no_android_generation",
      "status": "PASS"
    },
    {
      "detail": "21 topic groups/249 URLs discovered; sampled shell retrievals are not page-content verification.",
      "id": "F_discovered_not_verified",
      "status": "PASS"
    },
    {
      "detail": "VERIFIED requires retrieved page content, summary, review date, reviewer, and source section",
      "id": "G_retrieval_requires_attribution",
      "status": "PASS"
    },
    {
      "detail": "Actual discovery check is consumed by the existing P4 evaluator; invocation and SKILL.md reading remain separate NOT VERIFIED states.",
      "id": "H_skill_observability",
      "status": "PASS"
    },
    {
      "detail": "Release remains BLOCKED; version control=BLOCKED (expected BLOCKED from observed Git state); hosted CI=PASS; Material source verification=BLOCKED. A real CI PASS does not bypass the still-blocked Material.io source gate.",
      "id": "K_release_readiness_blocked",
      "status": "PASS"
    },
    {
      "detail": "t missing-context state.\nPASS masquerading_source_rejected: Third-party/URL-shaped refs cannot masquerade as official KB identifiers.\nPASS budget_overflow_fails_closed: No mandatory context is silently truncated to fit a small budget.\nPASS fresh_cache_validated: Fresh content cache validates its ID and fingerprint.\nPASS stale_cache_is_miss: Stale cached source requires refetch and is never silently trusted.\nPASS tampered_cache_is_miss: Cached content fingerprint mismatch is rejected.\nPASS delivery_and_consumption_distinct: Package creation/delivery does not establish actual model consumption.\nPASS target_api_compatibility_required: Neither official-doc retrieval nor task text establishes the target project's resolved AndroidX version.\nPASS context_package_schema: Fixture context package conforms to the machine-readable record schema.\nPASS failed_fetch_preserves_command_exit: Controlled CLI fetch failure is recorded and never promoted to retrieval.\nPASS search_network_failure_preserved: A network failure is retained as a failed search and prevents fetches.\nPASS missing_mandatory_local_context_blocked: Missing local reference remains explicit and is not treated as available context.\n",
      "id": "L_p0_p5_regressions",
      "status": "PASS"
    }
  ],
  "git_head": "f700ca6197dfad5da12546fc2767b44b534d041b",
  "harness_version": "0.6.0-dev",
  "hosted_ci": "PASS",
  "material_coverage": {
    "discovered_urls": 249,
    "page_evidence_record_counts": {
      "content_retrieved": 0,
      "discovered": 0,
      "retrieved_shell": 2,
      "verified": 0
    },
    "topic_groups_discovered": 21,
    "verified_page_content_topics": 0
  },
  "native_codex_skill_discovery": "PASS",
  "native_codex_skill_invocation": "NOT VERIFIED",
  "precision_comparison": {
    "aggregate": {
      "p5": {
        "budget_estimated_chars": {
          "max": 18387,
          "mean": 4515.68,
          "unit": "characters"
        },
        "classification_exact_accuracy": 1.0,
        "deterministic_cases": 40,
        "forbidden_source_selections": 0,
        "knowledge_precision": 0.8125,
        "knowledge_recall": 1.0,
        "policy_coverage": 1.0,
        "required_skill_recall": 1.0,
        "required_source_recall": 1.0,
        "skill_precision": 0.9338,
        "source_precision": 0.9767,
        "task_count": 40,
        "task_pass_count": 40
      },
      "p6": {
        "budget_estimated_chars": {
          "max": 13572,
          "mean": 5754.98,
          "unit": "characters"
        },
        "classification_exact_accuracy": 1.0,
        "deterministic_cases": 40,
        "forbidden_source_selections": 0,
        "knowledge_precision": 0.8368,
        "knowledge_recall": 1.0,
        "policy_coverage": 1.0,
        "required_skill_recall": 1.0,
        "required_source_recall": 1.0,
        "skill_precision": 0.9338,
        "source_precision": 0.9024,
        "task_count": 40,
        "task_pass_count": 40
      }
    },
    "androidx_api": {
      "cases": 4,
      "delta": 0.125,
      "failures": [],
      "p5": 0.625,
      "p6": 0.75,
      "required_knowledge_recall": 1.0
    },
    "harness": {
      "cases": 2,
      "delta": 0.375,
      "failures": [],
      "p5": 0.625,
      "p6": 1.0,
      "required_knowledge_recall": 1.0
    },
    "material3_content_design": {
      "cases": 1,
      "delta": 1.0,
      "failures": [],
      "p5": 0.0,
      "p6": 1.0,
      "required_knowledge_recall": 1.0
    },
    "material3_xr": {
      "cases": 1,
      "delta": 1.0,
      "failures": [],
      "p5": 0.0,
      "p6": 1.0,
      "required_knowledge_recall": 1.0
    }
  },
  "release_readiness": {
    "blockers": [
      "working tree is not clean against its tracked baseline",
      "harness release channel is 'development', not stable",
      "version tag is absent",
      "minimum verified Material.io topic-family coverage is not met"
    ],
    "candidate_license_files": [
      "LICENSE"
    ],
    "head": "f700ca6197dfad5da12546fc2767b44b534d041b",
    "hosted_ci": "PASS",
    "integration_tested": "PASS",
    "local_tested": "PASS",
    "local_validation_exit_code": 0,
    "local_validation_ready": "PASS",
    "material3_registered_topics": 21,
    "material3_verified_topics": 0,
    "material_source_verification": "BLOCKED",
    "release_candidate": "BLOCKED",
    "release_channel": "development",
    "release_ready": "BLOCKED",
    "release_version": "0.6.0-dev",
    "remote": "https://github.com/bzbbbzbbxnajjsjjsjx-lang/Android-brain.git",
    "repository_license_review": "PASS",
    "required_topic_families": {
      "accessibility": "material3_accessibility",
      "color": "material3_color",
      "components": "material3_components",
      "foundations": "material3_foundations",
      "typography": "material3_typography"
    },
    "stable_release": "BLOCKED",
    "tracked_file_count": 133,
    "verified_topic_families": {
      "accessibility": "BLOCKED",
      "color": "BLOCKED",
      "components": "BLOCKED",
      "foundations": "BLOCKED",
      "typography": "BLOCKED"
    },
    "version_control_ready": "BLOCKED",
    "version_tag_present": false,
    "working_tree_clean": false
  },
  "retrieval_records": [
    {
      "canonical_url": "https://m3.material.io/components/all-buttons",
      "content_type": "text/html; charset=utf-8",
      "http_status": 200,
      "limitation": "HTML response visibly states that JavaScript is required; only title/metadata were available to this retrieval. The button guidance itself was not reviewed.",
      "meta_description": "Buttons let people take action and make choices with one tap. Explore button types: elevated, filled, filled tonal, outlined, text, icon, segmented & more.",
      "page_content_obtained": false,
      "page_title": "All buttons – Material Design 3",
      "response_bytes": 61768,
      "response_sha256": "e94aa959ee9828539c4f1e84037c6ddbb6432cd3ba7a2dd228885ca2c1796269",
      "retrieved_at": "2026-10-14T15:11:40Z",
      "state": "retrieved_shell",
      "topic_id": "material3_components",
      "verified": false,
      "visible_non_script_text_chars": 31
    },
    {
      "canonical_url": "https://m3.material.io/styles/color/roles",
      "content_type": "text/html; charset=utf-8",
      "http_status": 200,
      "limitation": "HTML response visibly states that JavaScript is required; only title/metadata were available to this retrieval. Color-role guidance itself was not reviewed.",